{
    "checks": [
        {
            "id": "white-overprint",
            "status": "warning"
        }
    ],
    "errors": [
    ],
    "fixups_available": [
    ],
    "inspection_complete": true,
    "pass": true,
    "profile": "Frisket Test - White Overprint",
    "schema_version": 3,
    "warnings": [
        {
            "check_id": "white-overprint",
            "message": "White or near-white paint is set to overprint on page 1.",
            "page": 1,
            "scope": "page",
            "severity": "warning",
            "type": "white-overprint"
        }
    ]
}
